{
  "id": "idea-2026-10-01-supplier-bills",
  "channel": "c1-automation",
  "title": "How do small traders stop typing supplier bills into their books?",
  "summary": "Example data. A small trading business asks how to stop entering every supplier bill by hand.",
  "source": "reddit",
  "source_url": "https://example.com/r/smallbusiness/supplier-bills",
  "date": "2026-10-01"
}
